{
  "id": "snake-game",
  "name": "Snake Game",
  "shortDescription": "A classic Snake game with smooth controls, increasing speed, and retro-modern visuals. Use arrow keys or swipe to play!",
  "thumbnail": "thumbnail.svg",
  "createdAt": "2026-03-05T23:30:00Z",
  "category": "Games",
  "status": "active",
  "tags": ["game", "snake", "arcade", "keyboard-controls", "touch-controls"],
  "homepagePath": "index.html",
  "generation": {
    "agentName": "openclaw-dev-agent",
    "llmModel": "gpt-5.1",
    "startTime": "2026-03-05T23:25:00Z",
    "endTime": "2026-03-05T23:30:00Z",
    "totalTokensIn": 6200,
    "totalTokensOut": 4800,
    "runId": "run-2026-03-05-0005",
    "notes": "Original creation - classic Snake game with modern polish, touch support, and progressive difficulty."
  }
}
