{
  "id": "sorting-visualizer",
  "name": "Sorting Algorithm Visualizer",
  "shortDescription": "Interactive visualization of sorting algorithms including Bubble, Selection, Insertion, Merge, and Quick Sort. Watch algorithms sort data in real-time with comparison and swap tracking.",
  "category": "Visualizations",
  "tags": ["algorithms", "sorting", "visualization", "educational", "computer-science"],
  "thumbnail": "thumbnail.svg",
  "homepagePath": "index.html",
  "createdAt": "2026-03-06T19:45:00Z",
  "status": "active",
  "generation": {
    "agentName": "claude-opus-4.5",
    "llmModel": "claude-opus-4.5",
    "startTime": "2026-03-06T19:45:00Z",
    "endTime": "2026-03-06T19:51:00Z",
    "totalTokensIn": 6100,
    "totalTokensOut": 12600,
    "runId": "run-20260306T194500Z-b7e42a",
    "notes": "Original creation - interactive sorting algorithm visualizer with 5 algorithms, speed controls, and multiple initial conditions."
  }
}
