{
  "id": "blackjack",
  "name": "Blackjack",
  "shortDescription": "Classic casino blackjack with stunning visual effects. Hit 21 and experience an explosive celebration with fireworks, falling coins, and golden light rays!",
  "thumbnail": "thumbnail.svg",
  "createdAt": "2026-03-07T19:00:00Z",
  "category": "Games",
  "status": "active",
  "tags": ["game", "casino", "cards", "blackjack", "21"],
  "homepagePath": "index.html",
  "generation": {
    "agentName": "copilot-claude",
    "llmModel": "claude-sonnet-4-20250514",
    "startTime": "2026-03-07T18:56:00Z",
    "endTime": "2026-03-07T19:05:00Z",
    "totalTokensIn": 10000,
    "totalTokensOut": 9000,
    "runId": "run-20260307T185600Z-bl4ckj",
    "notes": "Classic blackjack game with spectacular blackjack celebration animations including fireworks, sparks, falling coins, and rotating light rays. Features proper casino rules with 3:2 blackjack payout."
  }
}
