{
  "id": "formation-frenzy",
  "name": "Formation Frenzy",
  "shortDescription": "Drag dancers into position to match target formations before time runs out! A fast-paced puzzle game inspired by halftime dance choreography on the football field.",
  "thumbnail": "thumbnail.svg",
  "createdAt": "2026-03-07T20:15:00Z",
  "category": "Games",
  "status": "active",
  "tags": ["puzzle", "drag-and-drop", "dance", "choreography", "timed"],
  "homepagePath": "index.html",
  "generation": {
    "agentName": "copilot-claude-agent",
    "llmModel": "claude-opus-4-5",
    "startTime": "2026-03-07T20:10:00Z",
    "endTime": "2026-03-07T20:15:00Z",
    "totalTokensIn": 6200,
    "totalTokensOut": 9800,
    "runId": "run-20260307T201000Z-f7c2a4",
    "notes": "Inspired by football halftime dance squads forming choreographed patterns. Features 12 formations including Line, V Shape, Diamond, Star, Circle, Arrow, Cross, Triangle, Wave, Heart, Zigzag, and Spiral."
  }
}
